{"video":"synthetic_shots.mp4","fps":120,"width":1920,"height":1080,"schema_version":"1.0","player_track_id":1,"frames":[{"f":0,"keypoints":{"nose":[800.0,363.7,0.93],"left_shoulder":[775.4,432.4,0.89],"right_shoulder":[786.6,433.3,0.93],"left_elbow":[781.1,554.8,0.91],"right_elbow":[778.5,554.1,0.93],"left_wrist":[832.8,648.6,0.96],"right_wrist":[832.9,646.1,0.85],"left_hip":[754.0,633.6,0.92],"right_hip":[761.9,628.6,0.94],"left_knee":[777.4,797.3,0.91],"right_knee":[847.6,770.2,0.87],"left_ankle":[696.9,938.5,0.9],"right_ankle":[750.6,902.5,0.93],"left_heel":[676.1,929.1,0.81],"right_heel":[731.5,892.8,0.76],"left_foot_index":[738.1,964.2,0.75],"right_foot_index":[790.9,933.9,0.78]}},{"f":1,"keypoints":{"nose":[804.1,365.4,0.92],"left_shoulder":[782.2,434.3,0.96],"right_shoulder":[786.8,435.8,0.94],"left_elbow":[766.3,554.1,0.88],"right_elbow":[801.9,552.0,0.97],"left_wrist":[810.1,652.7,0.9],"right_wrist":[867.1,643.6,0.91],"left_hip":[759.1,633.8,0.96],"right_hip":[768.4,633.7,0.92],"left_knee":[785.6,797.7,0.92],"right_knee":[850.5,772.8,0.92],"left_ankle":[697.4,937.6,0.91],"right_ankle":[756.0,905.2,0.93],"left_heel":[676.9,925.6,0.85],"right_heel":[737.7,889.7,0.76],"left_foot_index":[735.1,960.9,0.73],"right_foot_index":[797.5,932.7,0.82]}},{"f":2,"keypoints":{"nose":[805.9,368.1,0.92],"left_shoulder":[781.1,436.7,0.95],"right_shoulder":[789.1,437.3,0.93],"left_elbow":[757.3,553.0,0.9],"right_elbow":[817.3,552.4,0.93],"left_wrist":[781.6,659.6,0.85],"right_wrist":[898.0,627.0,0.84],"left_hip":[761.5,637.1,0.96],"right_hip":[766.3,638.0,0.94],"left_knee":[792.1,798.1,0.99],"right_knee":[854.5,775.9,0.92],"left_ankle":[696.3,931.5,0.91],"right_ankle":[758.0,910.4,0.9],"left_heel":[680.2,920.2,0.8],"right_heel":[741.8,894.4,0.78],"left_foot_index":[734.8,960.3,0.81],"right_foot_index":[797.9,939.1,0.75]}},{"f":3,"keypoints":{"nose":[812.2,365.3,0.9],"left_shoulder":[785.2,434.8,0.92],"right_shoulder":[794.3,438.1,0.96],"left_elbow":[746.6,548.4,0.9],"right_elbow":[833.0,547.1,0.92],"left_wrist":[760.5,658.7,0.98],"right_wrist":[920.7,616.4,0.93],"left_hip":[765.9,636.6,0.96],"right_hip":[774.6,638.1,0.93],"left_knee":[798.2,796.7,0.95],"right_knee":[861.2,774.9,0.97],"left_ankle":[699.5,931.0,0.95],"right_ankle":[764.7,913.5,0.97],"left_heel":[682.2,916.9,0.76],"right_heel":[750.8,900.9,0.84],"left_foot_index":[732.9,960.4,0.76],"right_foot_index":[804.9,939.6,0.77]}},{"f":4,"keypoints":{"nose":[812.6,369.0,0.93],"left_shoulder":[787.0,438.6,0.9],"right_shoulder":[794.8,439.8,0.89],"left_elbow":[739.3,543.7,0.93],"right_elbow":[847.1,543.9,0.9],"left_wrist":[742.3,656.0,0.94],"right_wrist":[945.2,602.3,0.94],"left_hip":[769.7,637.8,0.97],"right_hip":[775.0,639.1,0.87],"left_knee":[806.2,798.9,0.93],"right_knee":[862.1,772.6,0.98],"left_ankle":[696.8,920.2,0.9],"right_ankle":[772.6,913.6,0.91],"left_heel":[681.7,914.0,0.76],"right_heel":[752.1,901.2,0.82],"left_foot_index":[738.6,957.8,0.81],"right_foot_index":[808.2,941.2,0.82]}},{"f":5,"keypoints":{"nose":[816.4,367.2,0.92],"left_shoulder":[795.8,438.8,0.99],"right_shoulder":[801.8,434.9,0.96],"left_elbow":[734.3,542.0,0.94],"right_elbow":[859.4,541.6,0.89],"left_wrist":[732.1,651.8,0.98],"right_wrist":[955.6,593.6,0.99],"left_hip":[776.1,640.2,0.86],"right_hip":[780.5,638.7,0.97],"left_knee":[812.3,799.1,0.94],"right_knee":[867.0,779.0,0.93],"left_ankle":[702.1,921.6,0.93],"right_ankle":[775.5,916.6,0.99],"left_heel":[684.7,908.0,0.8],"right_heel":[755.4,904.1,0.84],"left_foot_index":[739.2,951.8,0.8],"right_foot_index":[813.3,944.2,0.8]}},{"f":6,"keypoints":{"nose":[818.8,370.4,0.92],"left_shoulder":[794.8,440.9,0.93],"right_shoulder":[804.1,439.7,0.99],"left_elbow":[733.8,537.1,0.89],"right_elbow":[870.2,537.8,0.89],"left_wrist":[728.1,649.6,0.97],"right_wrist":[970.3,587.0,0.95],"left_hip":[774.2,639.0,0.91],"right_hip":[784.4,637.3,0.99],"left_knee":[818.4,799.6,0.9],"right_knee":[866.3,780.2,0.92],"left_ankle":[706.5,919.9,0.92],"right_ankle":[779.4,922.9,0.93],"left_heel":[690.6,901.5,0.83],"right_heel":[756.3,905.4,0.83],"left_foot_index":[742.9,952.1,0.84],"right_foot_index":[818.5,943.8,0.74]}},{"f":7,"keypoints":{"nose":[821.1,370.1,0.9],"left_shoulder":[797.9,440.4,0.92],"right_shoulder":[809.9,442.1,0.88],"left_elbow":[734.3,539.4,0.97],"right_elbow":[872.1,537.9,0.92],"left_wrist":[722.9,649.5,0.88],"right_wrist":[972.9,586.8,0.92],"left_hip":[778.6,639.4,0.86],"right_hip":[785.4,641.0,0.95],"left_knee":[823.6,796.8,0.94],"right_knee":[867.6,777.9,0.96],"left_ankle":[711.5,918.9,0.98],"right_ankle":[781.3,920.8,0.91],"left_heel":[694.4,904.0,0.87],"right_heel":[763.3,908.5,0.78],"left_foot_index":[746.5,947.8,0.79],"right_foot_index":[823.6,945.6,0.85]}},{"f":8,"keypoints":{"nose":[825.1,369.5,0.91],"left_shoulder":[801.0,440.0,0.89],"right_shoulder":[808.6,440.1,0.97],"left_elbow":[738.3,540.9,0.9],"right_elbow":[877.3,538.0,0.91],"left_wrist":[731.7,647.7,0.95],"right_wrist":[973.3,588.5,0.95],"left_hip":[781.5,638.8,0.93],"right_hip":[791.2,637.3,0.93],"left_knee":[829.0,798.7,0.93],"right_knee":[863.6,782.9,0.89],"left_ankle":[712.0,911.6,0.97],"right_ankle":[782.6,926.8,0.9],"left_heel":[698.0,899.0,0.78],"right_heel":[766.4,913.4,0.78],"left_foot_index":[745.2,951.0,0.76],"right_foot_index":[826.7,949.9,0.8]}},{"f":9,"keypoints":{"nose":[827.2,367.8,0.89],"left_shoulder":[808.1,441.1,0.88],"right_shoulder":[812.2,439.0,0.89],"left_elbow":[742.9,542.8,0.99],"right_elbow":[875.4,539.9,0.89],"left_wrist":[742.3,650.1,0.92],"right_wrist":[971.7,593.6,0.99],"left_hip":[783.4,637.8,0.9],"right_hip":[792.7,638.3,0.93],"left_knee":[838.2,796.2,0.89],"right_knee":[869.6,784.5,0.98],"left_ankle":[719.4,909.7,0.9],"right_ankle":[786.8,927.6,0.9],"left_heel":[704.1,895.4,0.83],"right_heel":[766.3,917.2,0.8],"left_foot_index":[751.9,945.7,0.8],"right_foot_index":[826.6,952.7,0.81]}},{"f":10,"keypoints":{"nose":[833.6,369.2,0.85],"left_shoulder":[809.4,438.2,0.92],"right_shoulder":[817.6,437.9,0.89],"left_elbow":[756.8,545.9,0.93],"right_elbow":[869.0,544.7,0.94],"left_wrist":[761.0,656.2,0.95],"right_wrist":[962.4,605.5,0.94],"left_hip":[789.7,638.9,0.9],"right_hip":[796.6,635.1,0.95],"left_knee":[846.5,796.5,0.95],"right_knee":[861.9,788.2,0.94],"left_ankle":[720.1,908.9,0.92],"right_ankle":[786.3,931.8,0.87],"left_heel":[708.9,892.7,0.86],"right_heel":[772.0,922.6,0.87],"left_foot_index":[755.4,941.8,0.8],"right_foot_index":[831.9,955.3,0.83]}},{"f":11,"keypoints":{"nose":[837.9,369.9,0.96],"left_shoulder":[813.0,438.6,0.95],"right_shoulder":[818.6,439.0,0.89],"left_elbow":[773.5,546.3,0.93],"right_elbow":[861.0,547.8,0.92],"left_wrist":[787.9,659.8,0.84],"right_wrist":[947.5,617.3,0.95],"left_hip":[788.6,636.6,0.96],"right_hip":[800.8,639.9,0.95],"left_knee":[851.0,793.3,0.98],"right_knee":[861.2,788.2,0.96],"left_ankle":[733.7,905.5,0.97],"right_ankle":[790.0,938.9,0.93],"left_heel":[717.8,888.0,0.81],"right_heel":[769.5,928.2,0.8],"left_foot_index":[760.4,939.1,0.85],"right_foot_index":[831.6,954.8,0.82]}},{"f":12,"keypoints":{"nose":[842.1,366.4,0.91],"left_shoulder":[815.3,435.3,0.97],"right_shoulder":[823.6,438.0,0.94],"left_elbow":[787.8,552.7,0.94],"right_elbow":[854.0,551.5,0.92],"left_wrist":[819.8,663.0,0.91],"right_wrist":[930.5,630.5,0.99],"left_hip":[796.8,633.9,0.99],"right_hip":[803.8,634.2,0.93],"left_knee":[853.8,792.0,0.86],"right_knee":[858.4,790.3,0.9],"left_ankle":[735.4,904.5,0.95],"right_ankle":[789.3,938.2,0.89],"left_heel":[720.9,886.2,0.86],"right_heel":[769.6,932.1,0.8],"left_foot_index":[767.0,937.9,0.75],"right_foot_index":[835.4,959.8,0.87]}},{"f":13,"keypoints":{"nose":[845.8,366.4,0.92],"left_shoulder":[819.4,439.0,0.96],"right_shoulder":[829.3,436.8,0.99],"left_elbow":[809.2,554.1,0.85],"right_elbow":[841.8,553.8,0.95],"left_wrist":[850.3,654.9,0.86],"right_wrist":[906.9,640.7,0.92],"left_hip":[802.6,634.9,0.84],"right_hip":[810.0,634.5,0.97],"left_knee":[860.7,786.4,0.86],"right_knee":[858.7,786.3,0.91],"left_ankle":[739.4,902.2,0.94],"right_ankle":[789.4,939.9,0.93],"left_heel":[726.0,882.6,0.79],"right_heel":[773.3,934.4,0.81],"left_foot_index":[776.3,935.4,0.86],"right_foot_index":[833.6,959.8,0.87]}},{"f":14,"keypoints":{"nose":[845.0,363.5,0.93],"left_shoulder":[823.6,433.8,0.99],"right_shoulder":[833.0,432.2,0.95],"left_elbow":[829.3,554.7,0.92],"right_elbow":[830.5,553.0,0.93],"left_wrist":[881.8,652.1,0.93],"right_wrist":[881.5,648.5,0.85],"left_hip":[804.9,635.6,0.96],"right_hip":[811.1,632.6,0.87],"left_knee":[869.1,784.6,0.9],"right_knee":[857.7,787.1,0.85],"left_ankle":[749.2,900.5,0.9],"right_ankle":[789.6,937.2,0.99],"left_heel":[731.7,881.8,0.78],"right_heel":[768.8,927.3,0.83],"left_foot_index":[781.4,935.3,0.84],"right_foot_index":[834.8,960.0,0.81]}},{"f":15,"keypoints":{"nose":[847.8,362.6,0.95],"left_shoulder":[827.5,430.4,0.92],"right_shoulder":[835.3,430.7,0.99],"left_elbow":[846.8,551.6,0.86],"right_elbow":[815.0,550.6,0.9],"left_wrist":[913.4,638.6,0.95],"right_wrist":[861.0,651.8,0.97],"left_hip":[805.7,633.2,0.91],"right_hip":[812.3,631.7,0.88],"left_knee":[872.2,783.1,0.89],"right_knee":[855.4,788.9,0.85],"left_ankle":[754.8,895.2,0.94],"right_ankle":[791.4,941.0,0.91],"left_heel":[738.3,883.7,0.81],"right_heel":[767.9,929.5,0.79],"left_foot_index":[788.8,935.1,0.87],"right_foot_index":[835.4,958.7,0.79]}},{"f":16,"keypoints":{"nose":[853.6,362.2,0.91],"left_shoulder":[829.6,428.5,0.98],"right_shoulder":[838.5,431.8,0.92],"left_elbow":[866.5,548.9,0.98],"right_elbow":[804.6,551.2,0.89],"left_wrist":[944.4,625.2,0.96],"right_wrist":[829.5,653.5,0.99],"left_hip":[811.9,629.7,0.95],"right_hip":[816.1,630.7,0.94],"left_knee":[877.6,781.6,0.92],"right_knee":[855.9,789.1,0.97],"left_ankle":[760.0,897.5,0.96],"right_ankle":[792.0,944.2,0.89],"left_heel":[746.1,882.8,0.87],"right_heel":[770.1,933.8,0.81],"left_foot_index":[797.4,931.4,0.76],"right_foot_index":[834.1,958.5,0.87]}},{"f":17,"keypoints":{"nose":[856.2,356.6,0.95],"left_shoulder":[835.1,430.7,0.97],"right_shoulder":[843.7,429.6